{
  "schemaVersion": "p4c2.oracle.v1",
  "oracleId": "p4c2-oracle-v1-a869876ab626-260821_110849+0700",
  "evidenceId": "E4-P4C2-ORACLE1",
  "targetBasisRef": "source-basis.json",
  "positiveCount": 21,
  "negativeCount": 11,
  "positiveRows": [
    {
      "rowId": "P001",
      "polarity": "positive_direct_export",
      "source": {
        "path": "modules/email/server/operations/email-operations-observability.ts",
        "fileSha256": "A9247972D44D0A74C411FB7CF83D681FEBA371C7A85EEB83F8986AFD6446E40C",
        "range": { "start": { "line": 35, "column": 1 }, "end": { "line": 46, "column": 3 } },
        "selectionRange": { "start": { "line": 35, "column": 13 }, "end": { "line": 35, "column": 41 } },
        "lexicalOwner": "<module>"
      },
      "declarationKind": "type_alias",
      "localName": "EmailOperationsMessageSignal",
      "expected": {
        "exportedName": "EmailOperationsMessageSignal",
        "exportKind": "direct_declaration",
        "meanings": ["type"],
        "typeOnly": true,
        "exportFactCount": 1,
        "fileToExportRelationCount": 1,
        "access": { "state": "absent", "value": null },
        "compatibility": { "isExported": true },
        "exportDiagnosticCount": 0,
        "child05DerivedState": "empty"
      },
      "derivation": "A top-level exported type alias creates one named, type-only direct export whose local and exported names coincide."
    },
    {
      "rowId": "P002",
      "polarity": "positive_direct_export",
      "source": {
        "path": "modules/email/server/operations/email-operations-observability.ts",
        "fileSha256": "A9247972D44D0A74C411FB7CF83D681FEBA371C7A85EEB83F8986AFD6446E40C",
        "range": { "start": { "line": 48, "column": 1 }, "end": { "line": 53, "column": 3 } },
        "selectionRange": { "start": { "line": 48, "column": 13 }, "end": { "line": 48, "column": 41 } },
        "lexicalOwner": "<module>"
      },
      "declarationKind": "type_alias",
      "localName": "EmailOperationsAttemptSignal",
      "expected": {
        "exportedName": "EmailOperationsAttemptSignal",
        "exportKind": "direct_declaration",
        "meanings": ["type"],
        "typeOnly": true,
        "exportFactCount": 1,
        "fileToExportRelationCount": 1,
        "access": { "state": "absent", "value": null },
        "compatibility": { "isExported": true },
        "exportDiagnosticCount": 0,
        "child05DerivedState": "empty"
      },
      "derivation": "A top-level exported type alias creates one named, type-only direct export whose local and exported names coincide."
    },
    {
      "rowId": "P003",
      "polarity": "positive_direct_export",
      "source": {
        "path": "modules/email/server/operations/email-operations-observability.ts",
        "fileSha256": "A9247972D44D0A74C411FB7CF83D681FEBA371C7A85EEB83F8986AFD6446E40C",
        "range": { "start": { "line": 55, "column": 1 }, "end": { "line": 59, "column": 3 } },
        "selectionRange": { "start": { "line": 55, "column": 13 }, "end": { "line": 55, "column": 39 } },
        "lexicalOwner": "<module>"
      },
      "declarationKind": "type_alias",
      "localName": "EmailOperationsEventSignal",
      "expected": {
        "exportedName": "EmailOperationsEventSignal",
        "exportKind": "direct_declaration",
        "meanings": ["type"],
        "typeOnly": true,
        "exportFactCount": 1,
        "fileToExportRelationCount": 1,
        "access": { "state": "absent", "value": null },
        "compatibility": { "isExported": true },
        "exportDiagnosticCount": 0,
        "child05DerivedState": "empty"
      },
      "derivation": "A top-level exported type alias creates one named, type-only direct export whose local and exported names coincide."
    },
    {
      "rowId": "P004",
      "polarity": "positive_direct_export",
      "source": {
        "path": "modules/email/server/operations/email-operations-observability.ts",
        "fileSha256": "A9247972D44D0A74C411FB7CF83D681FEBA371C7A85EEB83F8986AFD6446E40C",
        "range": { "start": { "line": 61, "column": 1 }, "end": { "line": 66, "column": 3 } },
        "selectionRange": { "start": { "line": 61, "column": 13 }, "end": { "line": 61, "column": 47 } },
        "lexicalOwner": "<module>"
      },
      "declarationKind": "type_alias",
      "localName": "EmailOperationsProviderEventSignal",
      "expected": {
        "exportedName": "EmailOperationsProviderEventSignal",
        "exportKind": "direct_declaration",
        "meanings": ["type"],
        "typeOnly": true,
        "exportFactCount": 1,
        "fileToExportRelationCount": 1,
        "access": { "state": "absent", "value": null },
        "compatibility": { "isExported": true },
        "exportDiagnosticCount": 0,
        "child05DerivedState": "empty"
      },
      "derivation": "A top-level exported type alias creates one named, type-only direct export whose local and exported names coincide."
    },
    {
      "rowId": "P005",
      "polarity": "positive_direct_export",
      "source": {
        "path": "modules/email/server/operations/email-operations-observability.ts",
        "fileSha256": "A9247972D44D0A74C411FB7CF83D681FEBA371C7A85EEB83F8986AFD6446E40C",
        "range": { "start": { "line": 68, "column": 1 }, "end": { "line": 74, "column": 3 } },
        "selectionRange": { "start": { "line": 68, "column": 13 }, "end": { "line": 68, "column": 43 } },
        "lexicalOwner": "<module>"
      },
      "declarationKind": "type_alias",
      "localName": "EmailOperationsReadinessSignal",
      "expected": {
        "exportedName": "EmailOperationsReadinessSignal",
        "exportKind": "direct_declaration",
        "meanings": ["type"],
        "typeOnly": true,
        "exportFactCount": 1,
        "fileToExportRelationCount": 1,
        "access": { "state": "absent", "value": null },
        "compatibility": { "isExported": true },
        "exportDiagnosticCount": 0,
        "child05DerivedState": "empty"
      },
      "derivation": "A top-level exported type alias creates one named, type-only direct export whose local and exported names coincide."
    },
    {
      "rowId": "P006",
      "polarity": "positive_direct_export",
      "source": {
        "path": "modules/email/server/operations/email-operations-observability.ts",
        "fileSha256": "A9247972D44D0A74C411FB7CF83D681FEBA371C7A85EEB83F8986AFD6446E40C",
        "range": { "start": { "line": 76, "column": 1 }, "end": { "line": 80, "column": 3 } },
        "selectionRange": { "start": { "line": 76, "column": 13 }, "end": { "line": 76, "column": 45 } },
        "lexicalOwner": "<module>"
      },
      "declarationKind": "type_alias",
      "localName": "EmailOperationsSuppressionSignal",
      "expected": {
        "exportedName": "EmailOperationsSuppressionSignal",
        "exportKind": "direct_declaration",
        "meanings": ["type"],
        "typeOnly": true,
        "exportFactCount": 1,
        "fileToExportRelationCount": 1,
        "access": { "state": "absent", "value": null },
        "compatibility": { "isExported": true },
        "exportDiagnosticCount": 0,
        "child05DerivedState": "empty"
      },
      "derivation": "A top-level exported type alias creates one named, type-only direct export whose local and exported names coincide."
    },
    {
      "rowId": "P007",
      "polarity": "positive_direct_export",
      "source": {
        "path": "modules/email/server/operations/email-operations-observability.ts",
        "fileSha256": "A9247972D44D0A74C411FB7CF83D681FEBA371C7A85EEB83F8986AFD6446E40C",
        "range": { "start": { "line": 82, "column": 1 }, "end": { "line": 89, "column": 3 } },
        "selectionRange": { "start": { "line": 82, "column": 13 }, "end": { "line": 82, "column": 36 } },
        "lexicalOwner": "<module>"
      },
      "declarationKind": "type_alias",
      "localName": "EmailOperationsSnapshot",
      "expected": {
        "exportedName": "EmailOperationsSnapshot",
        "exportKind": "direct_declaration",
        "meanings": ["type"],
        "typeOnly": true,
        "exportFactCount": 1,
        "fileToExportRelationCount": 1,
        "access": { "state": "absent", "value": null },
        "compatibility": { "isExported": true },
        "exportDiagnosticCount": 0,
        "child05DerivedState": "empty"
      },
      "derivation": "A top-level exported type alias creates one named, type-only direct export whose local and exported names coincide."
    },
    {
      "rowId": "P008",
      "polarity": "positive_direct_export",
      "source": {
        "path": "modules/email/server/operations/email-operations-observability.ts",
        "fileSha256": "A9247972D44D0A74C411FB7CF83D681FEBA371C7A85EEB83F8986AFD6446E40C",
        "range": { "start": { "line": 91, "column": 1 }, "end": { "line": 97, "column": 23 } },
        "selectionRange": { "start": { "line": 91, "column": 13 }, "end": { "line": 91, "column": 37 } },
        "lexicalOwner": "<module>"
      },
      "declarationKind": "type_alias",
      "localName": "EmailOperationsAlertCode",
      "expected": {
        "exportedName": "EmailOperationsAlertCode",
        "exportKind": "direct_declaration",
        "meanings": ["type"],
        "typeOnly": true,
        "exportFactCount": 1,
        "fileToExportRelationCount": 1,
        "access": { "state": "absent", "value": null },
        "compatibility": { "isExported": true },
        "exportDiagnosticCount": 0,
        "child05DerivedState": "empty"
      },
      "derivation": "A top-level exported type alias creates one named, type-only direct export whose local and exported names coincide."
    },
    {
      "rowId": "P009",
      "polarity": "positive_direct_export",
      "source": {
        "path": "modules/email/server/operations/email-operations-observability.ts",
        "fileSha256": "A9247972D44D0A74C411FB7CF83D681FEBA371C7A85EEB83F8986AFD6446E40C",